Profile,Company,Year,Interpretation
full_diagnostic,Kenya Airways,2021,"summary
Kenya Airways (2021) exhibits materially weakened liquidity, profitability and coverage metrics. Current and quick ratios are well below conventional liquidity thresholds. Profitability measures (gross, operating, net margins, and ROA) are negative, indicating the company incurred losses on operations and on assets employed in 2021. Interest coverage is negative, and the debt-to-equity ratio is negative, consistent with reported negative shareholders’ equity. Return on equity (ROE) is positive per the supplied figure; however, this should be interpreted cautiously given the overall loss-making operating and asset performance. The profile indicates elevated financial distress risk for the period under review.

key_risks
- Liquidity risk: current_ratio = 0.317. This is below the conservative benchmark of 1.0, indicating potential short-term liquidity insufficiency to meet current obligations.
- Near-cash liquidity risk: quick_ratio = 0.291. This is below the conservative benchmark of 1.0, indicating limited ability to cover current liabilities without relying on inventory or non-liquid assets.
- Operational unprofitability: gross_margin = -0.0969 (approximately -9.7%). The gross margin is negative, indicating cost of goods/operations exceeded revenue.
- Operating performance: operating_margin = -1.1938 (approximately -119.4%). This negative operating margin denotes substantial operating losses relative to revenue.
- Net loss position: net_margin = -1.3253 (approximately -132.5%), indicating net losses materially exceeding revenue for 2021.
- Coverage/solvency risk: interest_coverage = -8.9301. A negative interest coverage ratio indicates earnings were insufficient to cover interest expense.
- Capital structure / equity risk: debt_equity = -2.8666. A negative debt-to-equity ratio indicates negative shareholders’ equity (liabilities exceed assets), which raises solvency and covenant risks.
- Asset efficiency and returns: asset_turnover = 0.4514 and roa = -0.5983 (approximately -59.8%). Asset turnover is modest and ROA is negative, reflecting losses on asset base.
- Reconciling ROE with other metrics: roe = 1.1167 (111.67%) is positive despite negative ROA and net margin. This inconsistency merits further analytical review of the underlying components (for example, effects of negative equity or one‑off items) because it may reflect distortions from negative equity or non-operational items.

recommendations
- Immediate liquidity assessment: prepare a short-term cash flow forecast (rolling 90–180 days) and prioritize liquidity-preserving actions (e.g., negotiate payables, defer non-critical capital expenditures, accelerate receivables where feasible).
- Covenant and creditor engagement: review debt covenants and proactively engage lenders and lessors to discuss waivers, forbearance or restructuring given negative equity and negative interest coverage.
- Cost and route rationalization: conduct a disciplined review of operating cost drivers and route network profitability to reduce operating losses. Implement measurable, time-bound cost-reduction initiatives.
- Capital structure remediation: evaluate options to restore positive equity (equity injection, debt-for-equity conversions, or restructuring), with scenario analyses for stakeholder impacts.
- Detailed forensics on ROE variance: perform an accounting and structural review to reconcile the positive ROE with negative operating and asset returns — specifically examine effects of negative equity, one-off items, tax or non-operating gains/losses.
- Stress testing and contingency planning: run downside and liquidity stress scenarios to quantify solvency timelines and inform contingency capital or operational actions.
- Strengthen financial reporting and disclosures: ensure full disclosure of factors causing negative equity, significant non-recurring items, and assumptions used in management forecasts to support stakeholder decision-making.

confidence_notes
- Scope: Analysis is limited to the provided 2021 ratio set. No additional financial statement details, notes, or trend data were provided.
- Limitations: The assessment does not incorporate subsequent periods, off‑balance-sheet items, management forecasts, or qualitative operational factors beyond the supplied ratios.
- Recommendation basis: All observations are strictly derived from the supplied metrics. Further audit-grade conclusions require review of the full financial statements, notes, management representations, and supporting schedules."
full_diagnostic,Kenya Airways,2022,"summary
Kenya Airways (2022) exhibits materially adverse liquidity, profitability and solvency indicators based on the supplied ratios. Short-term liquidity is severely constrained. Profitability metrics are negative at the operating and net levels. The balance sheet shows a negative equity signal (negative debt-to-equity), and interest coverage is negative, indicating operating losses are insufficient to cover interest expense. These items collectively indicate elevated financial stress and heightened going-concern and covenant risk that warrant immediate management and stakeholder attention.

key_risks
- Liquidity risk: current_ratio = 0.355 and quick_ratio = 0.336. Both are substantially below commonly accepted conservative thresholds (1.0), indicating limited ability to meet short-term obligations from existing current assets.
- Operational unprofitability: gross_margin = -0.048 and operating_margin = -1.096. Negative gross margin indicates cost of operations exceeded revenue before operating expenses; the operating margin shows deep operating losses.
- Net loss and cash strain: net_margin = -1.377 indicates large net losses relative to revenue. This contributes to cash depletion and impaired ability to fund operations without external support.
- Solvency / equity impairment: debt_equity = -2.563. A negative debt-to-equity ratio is consistent with negative shareholders’ equity (or accounting anomalies) and represents material solvency concern.
- Interest serviceability: interest_coverage = -3.892. Negative coverage means operating income is a loss and does not cover interest expense, increasing default risk on debt.
- Asset efficiency vs. losses: asset_turnover = 0.691 is moderate, but roa = -0.952 is highly negative, indicating asset base is producing losses rather than returns.
- Return on equity anomaly: roe = 1.488 (148.8%). This unusually high positive ROE alongside negative ROA and negative equity implies distorted return measures caused by negative equity; this is an accounting anomaly rather than a sign of healthy shareholder returns and should be treated as a financial-statement warning signal.

recommendations
- Immediate liquidity actions: prioritize preservation of cash; prepare a short-term liquidity plan (30–90 days) including cash-flow projections, working capital tightening, negotiated vendor/payment terms, and contingency funding sources.
- Capital and covenant review: assess the need for equity injection or debt restructuring. Engage lenders proactively to review covenants and seek waivers or amendments where necessary.
- Cost and network optimization: conduct an urgent review of route profitability and operating costs; implement targeted cost reductions while protecting core revenue-generating operations.
- Interest and debt management: evaluate opportunities to refinance or re-profile interest-bearing liabilities to reduce near-term interest burden; consider discussions with lessors and bondholders where applicable.
- Balance-sheet remediation: investigate the drivers of negative equity and correct any accounting issues; develop a plan to restore equity via capital contributions, retained-earnings recovery, or asset disposals if required.
- Transparency and governance: enhance disclosure to stakeholders on liquidity, covenant status and remediation plans; ensure audit committee and board oversight is active and documented.
- Further financial analysis: obtain and review the full 2022 financial statements (including cash-flow statement and notes) and post-year events to validate the ratios, confirm causes of negative equity, and quantify funding requirements.

confidence_notes
- Analysis is based solely on the supplied ratios for Kenya Airways for 2022. No additional financial statements, footnotes, segment data or post-period events were reviewed.
- The metrics pointing to negative shareholders’ equity (negative debt-to-equity) and the ROE/ROA divergence indicate accounting effects that require validation against audited financial statements and notes.
- Recommendations are precautionary and should be refined following review of the complete financial statements, cash-flow details, financing agreements and management plans."
full_diagnostic,Kenya Airways,2023,"summary
Kenya Airways — 2023 diagnostic (based on supplied ratios). The company exhibits materially stressed liquidity and profitability metrics and a capital structure consistent with negative equity. Key headline figures: current ratio 0.419, quick ratio 0.396, gross margin 5.78%, operating margin -88.44%, net margin -107.15%, debt-to-equity -2.302, interest coverage -4.70, asset turnover 1.011, return on assets (ROA) -108.29% (ratio -1.0829), return on equity (ROE) 138.53% (ratio 1.3853). The profile indicates significant operating losses and an inability, on an accounting basis, to cover interest from operating results.

key_risks
- Acute liquidity shortfall: current ratio (0.419) and quick ratio (0.396) are well below conventional conservative thresholds of 1.0, indicating current liabilities materially exceed readily available current assets.
- Unsustainable operating performance: operating margin (-0.884) and net margin (-1.072) are deeply negative, showing operating losses and overall losses on sales; these magnitudes are materially adverse to ongoing profitability.
- Negative equity / leverage concern: debt-to-equity is negative (-2.302), consistent with a capital structure where total liabilities exceed reported equity; this raises solvency and covenant risk.
- Interest servicing failure: interest coverage is negative (-4.704), indicating operating income is insufficient to meet interest expense on a pre-tax basis.
- Asset returns mismatch: ROA is negative (-1.083), indicating assets are generating losses overall; this contrasts with asset turnover near 1.0 but does not offset the negative margins.
- Earnings volatility or accounting distortions: ROE is positive (1.385) while ROA and net margin are negative, which is inconsistent under normal circumstances and suggests either a small or negative equity base or accounting/structural effects—this presents risk to interpretability of equity returns.

Explicitly highlighted metrics exceeding conservative thresholds
- Current ratio 0.419 (threshold: <1.0 — flagged)
- Quick ratio 0.396 (threshold: <1.0 — flagged)
- Operating margin -0.884 (threshold: <0.0 — flagged)
- Net margin -1.072 (threshold: <0.0 — flagged)
- Debt-to-equity -2.302 (threshold: negative / magnitude >1 — flagged)
- Interest coverage -4.704 (threshold: <1.0 or negative — flagged)
- ROA -1.083 (threshold: <0.0 — flagged)

recommendations
- Immediate liquidity actions: prepare a short-term cash plan (30–90 days) to prioritize critical cash outflows; consider drawing on committed facilities, vendor payment renegotiations, and suspension of non-essential capital expenditures.
- Capital structure remediation: assess options to restore positive equity — equity injection, debt-to-equity swap, or negotiated restructuring with creditors — and evaluate covenant compliance across debt facilities.
- Profitability-focused measures: implement targeted route/network, fleet, and capacity reviews to reduce operating losses; prioritize high-yield routes and examine controllable operating cost reductions with minimal safety/service compromise.
- Interest burden management: engage lenders to discuss covenant waivers/forbearance and, where possible, refinance or reprioritize interest-bearing obligations to reduce near-term interest service pressure.
- Governance and disclosure: ensure management provides transparent, frequent updates to creditors, shareholders, and regulators; consider commissioning an independent liquidity and solvency review if not already performed.
- Asset and working-capital optimisation: conduct a formal review of working capital components (receivables, inventory, payables) and non-core asset monetisation opportunities to improve the current ratio.
- Scenario planning: develop conservative downside and remediation scenarios, including runway estimates under varying cash preservation and capital injection assumptions, to inform stakeholder negotiations.

confidence_notes
- Analysis strictly based on the supplied ratio data for Kenya Airways (2023). No external financial statements, notes, or management commentary were used.
- Interpretations are conservative and limited to the metrics provided; causation or explanatory factors (e.g., one-time items, accounting adjustments, government support) were not assumed or introduced.
- The ROE/ROA divergence noted is an observation of apparent inconsistency in the supplied ratios; resolving this requires access to the underlying balance sheet and income statement detail.
- This communication is analytical and not an audit opinion or a substitute for comprehensive financial due diligence."
full_diagnostic,Kenya Airways,2024,"summary
Kenya Airways’ 2024 ratios present a mixed picture. Liquidity ratios are weak (current ratio 0.35; quick ratio 0.323), indicating limited short‑term liquid coverage of current liabilities. Profitability on an operating and net basis is positive (operating margin 19.65%; net margin 13.68%; gross margin 32.32%) and asset efficiency is high (asset turnover 1.05), producing a positive return on assets (ROA 14.40%). Capital structure shows a severe equity deficiency as reflected by a negative debt‑to‑equity ratio (–2.51) and a negative return on equity (ROE –21.81%). Interest coverage (3.32) is above commonly used conservative minimums. The provided composite score is 0.25 and risk band is reported as “low.” 

Key_risks
- Liquidity risk: current ratio (0.348) and quick ratio (0.323) are materially below standard conservative benchmarks (see highlighted metrics below), indicating potential difficulty meeting near‑term obligations without asset sales or new financing.
- Solvency / equity deficiency: debt_equity (–2.515) indicates negative shareholders’ equity or leverage that materially exceeds equity; this is an acute solvency concern for equity holders and may constrain financing options.
- Capital returns divergence: ROA (14.40%) is positive while ROE (–21.81%) is negative, signalling that although assets generate returns, equity value is impaired; this disparity increases risk for shareholders and may reflect prior losses or revaluations.
- Concentration of funding risk: although interest_coverage (3.32) is above common conservative thresholds, it is not high; any decline in operating income or increase in interest costs could rapidly pressure servicing capacity given the leverage profile.
- Operational dependency: strong asset turnover (1.05) supports margins, but the combination of weak liquidity and impaired equity creates execution risk for operational plans and fleet/capital decisions.

Explicitly highlighted metrics exceeding conservative thresholds (audit-style)
- Metrics failing conservative minimums / indicating concern:
  - Current_ratio = 0.348 (below conservative benchmark of 1.0; indicates insufficient short‑term coverage)
  - Quick_ratio = 0.323 (below conservative benchmark of 1.0; indicates limited immediate liquidity)
  - Debt_equity = –2.5146 (negative and magnitude >1.0; indicates equity deficit / very high leverage relative to equity)
  - ROE = –0.2181 (negative; fails basic return expectations for equity investors)
- Metrics meeting or exceeding conservative acceptability thresholds:
  - Interest_coverage = 3.3187 (at or above a commonly used conservative minimum of ~3.0; indicates current ability to cover interest from operating earnings)
  - Asset_turnover = 1.0524 (above 1.0; indicates efficient use of assets to generate revenue)
  - Gross_margin = 0.3232 and Net_margin = 0.1368 (margins above commonly referenced conservative profitability thresholds such as ~10%; indicate core business profitability)
  - ROA = 0.1440 (above a conservative benchmark of ~10%; indicates assets generate positive returns)

recommendations
- Immediate liquidity actions: prepare a near‑term cash plan (30/60/90 days) and maintain committed liquidity lines; evaluate working capital measures (receivables collection, payables timing, inventory management) to reduce short‑term mismatch.
- Capital structure / solvency remediation: engage stakeholders to address negative equity — options include retained earnings restoration through sustainable profitability, equity injection, debt restructuring, or negotiated creditor relief. Prioritise solutions that preserve operational continuity.
- Stress testing and covenant review: perform formal scenario and sensitivity analyses on earnings, interest rates, and cash flows; review existing debt covenants and proactively negotiate amendments where breach risk exists.
- Preserve interest coverage: maintain sufficient operating margin and cost discipline to keep interest coverage above the conservative minimum; avoid incremental high‑cost debt until solvency metrics improve.
- Governance and disclosure: ensure transparent disclosure to creditors and investors about liquidity and equity position, remedial plans, and triggers for contingency actions. Consider independent review of capital plans.
- Monitor operational performance: sustain or improve asset turnover and margins while aligning capacity/fleet plans with cash generation to avoid cash strain.

confidence_notes
- This analysis is limited to the ratios and composite score provided for Kenya Airways for 2024. No additional financial statements or trend data were reviewed.
- “Conservative thresholds” cited reflect commonly used benchmarks (e.g., current/quick ratio ~1.0; interest coverage ~3.0; asset turnover >1.0; profitability margins ~10%); thresholds are applied for audit‑style assessment only and were not derived from company‑specific policy.
- Conclusions are factual and based solely on the supplied ratios; they do not incorporate forward‑looking forecasts, non‑financial factors, or subsequent events. Further audit‑grade conclusions would require complete financial statements, notes, and management plans."
solvency_focus,Kenya Airways,2021,"summary
Kenya Airways – 2021: The provided solvency- and profitability-focused ratios indicate materially weak liquidity and operating performance together with a capital-structure condition that warrants close attention. Key signs include materially sub‑par current and quick ratios, negative operating and net margins, negative return on assets, a negative debt-to-equity ratio (implying negative shareholders’ equity), and a negative interest-coverage ratio. These metrics collectively point to elevated short‑term liquidity risk and impaired capacity to service debt from operating earnings in 2021.

key_risks
- Liquidity shortfall: Current ratio = 0.317 and Quick ratio = 0.291. Both are well below the conservative threshold of 1.0, indicating insufficient short‑term liquid resources to meet current liabilities.
- Operating loss and margin pressure: Operating margin = -1.1938 and Net margin = -1.3253. Both margins are negative, indicating operating losses and an overall loss after tax for the period.
- Negative gross margin: Gross margin = -0.0969, which is below a conservative 0.0 threshold, indicating cost of sales exceeded revenues before operating expenses.
- Solvency / capital structure concern: Debt/Equity = -2.8666. The negative sign indicates negative shareholders’ equity (numerator and denominator relationship), which is a significant capital-structure issue and increases creditor risk.
- Interest service shortfall: Interest coverage = -8.9301, well below the conservative threshold of 1.0, indicating operating income was insufficient to cover interest expense.
- Asset profitability: ROA = -0.5983 (negative) and Asset turnover = 0.4514 (below a conservative benchmark of 1.0). These indicate low asset productivity and negative returns on assets.
- ROE interpretation caution: ROE = 1.1167 is positive despite negative profitability and negative equity. This combination requires careful balance-sheet level analysis; ROE alone may be misleading given the negative equity shown by Debt/Equity.

recommendations
- Short-term liquidity actions: Prioritize measures to restore current liquidity (e.g., expense control, working capital tightening, renegotiation of short‑term payables). Maintain detailed cash‑flow forecasts under multiple stress scenarios.
- Capital structure remediation: Conduct a detailed balance-sheet review to confirm and quantify negative equity drivers. Explore equity recapitalization options, creditor restructuring, or covenant relief where feasible and appropriate to restore solvency indicators.
- Debt service strategy: Engage with lenders early to discuss covenant waivers, maturity extensions, or interest-rate/repayment adjustments given the negative interest-coverage ratio.
- Operational focus: Implement targeted operational cost reviews to reduce cash burn from core operations and pursue revenue recovery initiatives to improve gross and operating margins.
- Financial reporting and monitoring: Increase frequency of solvency and liquidity reporting (weekly cash, monthly covenant testing) and ensure transparent disclosures for stakeholders. Any use of ROE as a performance metric should be accompanied by an explanation of the balance-sheet context.
- Independent review: Consider an external forensic/financial review of 2021 results and balance sheet to validate drivers of negative equity and to support credible remediation plans for creditors and investors.

confidence_notes
- Analysis is based solely on the ratios supplied for Kenya Airways for 2021. No additional financial statement detail, cash‑flow figures, or notes were provided.
- Conclusions are limited to the implications of the provided ratios. Detailed cause-and-effect attribution (for example, the specific accounting or non‑recurring items driving negative equity or margins) cannot be made without the underlying financial statements and disclosures.
- Recommendations are conservative and intended for consideration by management, lenders, and auditors; implementation feasibility should be assessed with full access to books, cash‑flow forecasts, and contractual arrangements."
