Profile,Company,Year,Interpretation
solvency_focus,Kenya Airways,2022,"summary
Kenya Airways — 2022 (solvency-focused)

The provided 2022 ratios indicate acute liquidity and operating losses with a capital structure that appears distressed. Key liquidity indicators (current and quick ratios) are well below standard conservative thresholds of 1.0. Profitability and coverage measures are negative. The reported debt-to-equity ratio is negative and of large magnitude, and interest coverage is substantially below 1.0. These signals are consistent with material solvency pressure in 2022.

key_risks
- Liquidity shortfall: Current ratio = 0.355 and Quick ratio = 0.336. Both are materially below a conservative threshold of 1.0, indicating limited near-term liquid resources relative to short-term obligations.
- Operating and net losses: Operating margin = -109.62% and Net margin = -137.74%. Operating loss and negative net margin increase the risk that operating cash flows will remain insufficient to meet obligations.
- Negative/unstable capital structure: Debt-to-equity = -2.5627 (negative equity implied). This magnitude exceeds conservative thresholds and indicates the balance sheet equity position may be impaired.
- Interest payment vulnerability: Interest coverage = -3.892 (well below a conservative threshold of 1.0). Negative coverage indicates operating income is insufficient to cover interest expense.
- Negative return on assets: ROA = -95.23% signals poor asset profitability relative to the asset base, which can impair the ability to generate cash from operations.
- Potential distortion in ROE: ROE = 148.82% is positive while several other profitability and solvency measures are negative. This divergence can reflect accounting effects such as negative or very small equity; it warrants focused review of equity and earnings composition. (This is an observation based on supplied ratios; it is not an explanation of cause.)

recommendations
- Immediate liquidity actions: Prioritize short-term liquidity preservation (cash-conservation measures, suspension or delay of non-essential capital expenditures, tight working capital management).
- Debt and covenant review: Conduct an urgent review of existing debt covenants and repayment profiles. Engage lenders to discuss covenant relief, maturity extensions, or temporary waivers where necessary.
- Capital structure remediation: Evaluate options for capital injection or equity recapitalization to address the negative debt-to-equity metric and restore a positive equity buffer.
- Interest burden mitigation: Assess feasibility of refinancing high-cost debt, negotiating lower interest terms, or converting debt to equity where permissible.
- Operational restructuring: Implement targeted cost-reduction measures to reduce operating losses and improve operating margin; focus on high-cost lines and noncore expenditures.
- Asset and cash generation: Identify noncore asset dispositions or sale-leaseback arrangements that can generate near-term cash without materially disrupting core operations.
- Governance and reporting: Strengthen financial reporting cadence and scenario planning (short-, medium-, and long-term liquidity forecasts) to provide lenders and stakeholders with transparent information.
- Audit and forensics: Given the negative equity indicator and mixed profitability signals, perform a detailed balance sheet review (including off-balance-sheet items, deferred liabilities, and asset impairment testing) to confirm the underlying drivers and to support any stakeholder discussions.

confidence_notes
- The assessment is based solely on the supplied ratio values for Kenya Airways for 2022. No underlying financial statements, cash flow statements, footnotes, or subsequent-period information were provided.
- The ratios reliably indicate severe liquidity and solvency pressure, but the precise causes, timing, and contractual details (debt maturities, covenant language, off-balance-sheet exposures) cannot be determined from ratios alone.
- Recommendations are conservative and intended for immediate risk mitigation and further diagnostic work; implementation should follow detailed review of primary financial statements and agreements."
solvency_focus,Kenya Airways,2023,"summary
Kenya Airways' 2023 solvency profile shows pronounced liquidity and solvency stress. Key short-term liquidity ratios (current and quick) are well below conservative benchmarks, operating and net margins are substantially negative, and interest coverage is materially negative. The balance-sheet leverage indicator (debt-to-equity) is negative, consistent with reported negative equity or accounting treatment that results in liabilities exceeding equity. These outcomes indicate elevated risk to the company's ability to meet obligations without corrective action.

key_risks
- Current ratio: 0.4190 — materially below a conservative threshold of 1.0, indicating potential inability to cover current liabilities with current assets.
- Quick ratio: 0.3965 — materially below a conservative threshold of 1.0, indicating limited near-cash resources to meet short-term obligations.
- Operating margin: -0.8844 — negative operating profitability; operating losses suggest ongoing cash outflows from core operations.
- Net margin: -1.0715 — negative net profitability, indicating losses after all expenses and below conservative expectation of non-negative net margin.
- Interest coverage: -4.7042 — negative; earnings do not cover interest expense. This exceeds conservative stress thresholds (coverage <1.0) and implies elevated default risk on interest-bearing debt.
- Debt-to-equity: -2.3023 — negative (magnitude significant). A negative debt-to-equity ratio indicates equity is negative (liabilities exceed assets) or non-standard capital structure; this exceeds conservative solvency thresholds and signals potential balance-sheet impairment.
- Return on assets (ROA): -1.0829 — negative return on the asset base, indicating assets are not generating positive accounting returns.
- Note on ROE: Reported ROE is 1.3853 (positive) while other profitability and solvency metrics are negative; this combination is atypical and warrants careful accounting review. (No further inference is made.)

recommendations
- Liquidity preservation: Prioritise short-term liquidity actions (tighten working capital, delay non-essential capital expenditures, accelerate receivables where practicable) to address current and quick ratio shortfalls.
- Debt/interest mitigation: Engage creditors to restructure near-term debt and interest obligations (reprofile maturities, seek covenant waivers, or negotiate interest relief) to reduce default risk given negative interest coverage.
- Capital restoration: Evaluate options to restore equity (capital injection, government/support measures, strategic investor) or deleverage (asset disposals targeted at non-core assets) to address negative equity and the negative debt-to-equity indicator.
- Operational focus: Implement rigorous cost-containment and route/network optimization to reduce operating losses; however, any cost actions should be assessed for impact on revenue-generating capability.
- Governance and reporting: Commission an independent review of financial statements and key accounting judgments that affect equity and leverage metrics (e.g., impairment assessments, remeasurements) to confirm the basis of the negative equity and reconcile the ROE anomaly.
- Covenant and stakeholder communication: Proactively communicate with lenders, lessors, and key suppliers about the remediation plan and likely timelines to manage covenant breach risk and maintain critical counterparty relationships.
- Contingency planning: Prepare and maintain a liquidity contingency plan (cash-flow forecasts under downside scenarios) and formal monitoring triggers for escalation.

confidence_notes
- Analysis is limited to the supplied 2023 ratio values and does not incorporate underlying financial statement line items, cash-flow details, subsequent events, or management actions after the reporting date.
- No assumptions beyond the provided ratios have been made. Where ratios imply negative equity or unusual accounting outcomes (e.g., negative debt-to-equity), the report flags these for review but does not infer causes.
- Recommendations are precautionary and framed without detailed modelling; their applicability should be validated against the full financial statements and operational data."
solvency_focus,Kenya Airways,2024,"summary
Kenya Airways — 2024 (solvency-focused summary):
- Liquidity: Current ratio 0.348 and quick ratio 0.323. Both are materially below commonly used conservative benchmarks (1.0), indicating limited short‑term liquid resources relative to short‑term obligations.
- Leverage: Debt-to-equity reported as -2.515, which reflects negative equity (liabilities exceed assets) and material leverage risk.
- Coverage: Interest coverage 3.319, which is positive and indicates earnings available to meet interest, but is modest relative to conservative coverage expectations.
- Profitability and efficiency: Gross margin 32.32%, operating margin 19.65%, net margin 13.68%, asset turnover 1.052, and ROA 14.40% — these indicate the company is generating a positive return on assets and profitable operations in 2024. ROE is negative (-21.81%), consistent with negative equity reported above.

key_risks
- Acute liquidity shortfall: Current ratio (0.348) and quick ratio (0.323) both exceed conservative risk thresholds for liquidity stress (i.e., they are materially below 1.0). This implies potential difficulty meeting near-term obligations without asset sales, refinancing, or new financing.
- Negative equity / structural leverage: Debt-to-equity of -2.515 denotes negative shareholders’ equity and substantial leverage risk. This condition increases vulnerability to shocks and may constrain access to external financing.
- Interest coverage concentration risk: Interest coverage (3.319) is above the minimum of 1.0 but below many conservative thresholds used by credit analysts (e.g., 3–4x). While sufficient to cover interest in 2024, it provides limited cushion against profit declines or interest rate increases.
- Return-to-equity disconnect: Positive ROA (14.39%) alongside negative ROE (-21.81%) reflects returns generated by assets but eroded or absorbed by the capital structure (negative equity). This structural issue may be a persistent solvency concern until equity position is restored.

recommendations
- Prioritise near-term liquidity actions: develop a documented, prioritized plan to increase short-term liquid resources (e.g., renegotiate creditor payment terms, secure committed short-term financing, or monetize non-core assets). Ensure contingency triggers and timelines are defined.
- Address capital structure: perform a capital restructuring assessment to restore positive equity where feasible (options could include equity injections, debt-to-equity conversions, or negotiated creditor settlements). Any chosen path should be evaluated for covenant, tax, and accounting implications.
- Strengthen interest coverage buffer: aim to increase recurring operating cashflow margins or reduce interest-bearing liabilities to move interest coverage above conservative buffers (e.g., toward or above 4x), to improve resilience to earnings volatility.
- Enhance reporting and monitoring: implement monthly liquidity and covenant reporting with scenario stress-testing (sensitivity to traffic, fuel, and rate changes). Maintain documented escalation procedures if key ratios deteriorate.
- Engage stakeholders early: communicate proactively with lenders, lessors, and major suppliers about the company’s near-term plans to reduce the risk of sudden enforcement actions that could exacerbate solvency pressure.

confidence_notes
- These observations are based solely on the provided 2024 ratio values and standard conservative benchmarks. No additional financial statements, cashflow details, maturities schedule, off‑balance-sheet exposures, recent financing agreements, or management plans were provided.
- Conclusions about solvency and liquidity are constrained by the single-year snapshot; multi-year trends, seasonality, and post-year events are not available for review.
- Recommendations are prescriptive in nature and should be validated by a full review of audited financial statements, covenants, and legal/contractual documents prior to implementation."
liquidity_focus,Kenya Airways,2021,"summary
Kenya Airways (2021) exhibits material liquidity and solvency concerns. Key short-term liquidity metrics (current ratio and quick ratio) are well below conservative thresholds. Profitability measures are negative at the gross, operating and net levels. Leverage and coverage measures indicate negative shareholders’ equity and inadequate ability to service interest. The combination of low liquidity, negative margins and negative interest coverage presents heightened risk to near-term operational continuity absent corrective action.

key_risks
- Current ratio: 0.317 (conservative threshold: < 1.0 indicates concern). The current ratio is materially below 1.0, indicating current liabilities substantially exceed current assets.
- Quick ratio: 0.291 (conservative threshold: < 1.0 indicates concern). The quick ratio is materially below 1.0, indicating very limited immediately liquid assets relative to current liabilities.
- Gross margin: -9.69% (conservative threshold: < 0.0 indicates concern). Negative gross margin indicates cost of sales exceeded revenue in 2021.
- Operating margin: -119.38% (conservative threshold: < 0.0 indicates concern). Deep operating loss relative to revenue.
- Net margin: -132.53% (conservative threshold: < 0.0 indicates concern). Net losses materially erode earnings.
- Debt-to-equity: -2.867 (conservative threshold: negative equity or ratio indicating < 0.0 is a concern). Negative debt/equity indicates negative shareholders’ equity; this is a significant solvency signal.
- Interest coverage: -8.93 (conservative threshold: < 1.0 indicates concern). Negative coverage indicates operating losses exceeded interest expense; ability to meet interest from operating earnings is inadequate.
- Return on assets (ROA): -59.83% (conservative threshold: < 0.0 indicates concern). Negative return on assets.
- Asset turnover: 0.451 (conservative threshold: context-dependent; conservative concern if materially below industry norms). Asset turnover is modest; combined with negative margins this contributes to poor returns.
- Return on equity (ROE): 111.67% (note of caution). Although ROE is positive, this likely reflects negative equity in the denominator rather than strong earnings performance; interpret with extreme caution.

recommendations
- Prioritise short-term liquidity: develop and implement a formal liquidity plan that addresses immediate funding needs (cash preservation, working capital controls, short-term financing options). Given the current and quick ratios, focus on converting non-core current assets to cash and renegotiating payment terms where feasible.
- Address solvency signals: assess capital structure options, including equity recapitalisation or creditor restructuring, to restore positive shareholders’ equity and reduce leverage-related risk.
- Contain operating losses: perform a rigorous cost and route-network review to reduce operating expenses and improve gross margin; however, any cost actions should be validated against safety and regulatory requirements.
- Interest and debt servicing: engage creditors proactively to explore covenant relief, payment deferrals, or refinancing to mitigate the immediate interest coverage shortfall.
- Improve financial transparency and monitoring: enhance cash-flow forecasting (short-term rolling 13-week and medium-term 12-month scenarios), and institute regular liquidity stress-testing and contingency planning.
- Independent review: consider an independent financial and operational review to quantify required capital, assess going-concern viability, and validate remedial measures.

confidence_notes
- Analysis is based solely on the provided 2021 ratio values; no additional financial statements, notes, or subsequent-period information were considered.
- Recommendations are cautious and limited to liquidity and solvency matters; they do not constitute audit opinion or legal, tax, or investment advice.
- Some ratios (notably ROE and debt/equity) reflect balance-sheet impairments (negative equity) which can produce anomalous ratio behavior; interpret those specific ratios with caution and verify with the underlying financial statements."
liquidity_focus,Kenya Airways,2022,"summary:
Kenya Airways' 2022 financial ratios indicate materially constrained short-term liquidity and negative profitability. The current ratio (0.355) and quick ratio (0.336) are well below commonly used conservative thresholds for short-term solvency. Profitability measures (gross margin, operating margin, net margin, ROA) are negative. Interest coverage is negative, indicating operating losses relative to financing costs. Debt/equity is negative, which signals equity base or accounting presentation issues that impair typical leverage interpretation. These factors, taken together, point to elevated liquidity and solvency risk in 2022.

key_risks:
- Current ratio (0.355) and quick ratio (0.336): both are below a conservative threshold of 1.0, indicating potential inability to meet short-term obligations from current assets.
- Interest coverage (-3.892): below a conservative threshold of 1.0 and negative, indicating operating cash generation is insufficient to cover reported interest expense.
- Negative profitability metrics: gross margin (-4.81%), operating margin (-109.62%), net margin (-137.74%), and ROA (-95.23%) exceed conservative concern thresholds (any negative margin or negative ROA) and indicate losses that can deplete liquidity.
- Debt/equity (-2.563): negative value exceeds conservative concern for leverage (negative equity or sign reversal), complicating standard leverage assessment and potentially restricting access to additional debt financing.
- ROE (1.488): while positive, this ratio is inconsistent with negative profitability and a negative debt/equity; it should be treated with caution and requires further reconciliation to underlying balance-sheet items before reliance.

recommendations:
- Prioritise working capital management: accelerate receivables collection, tighten credit terms where feasible, and control inventory and other short-term asset outflows to improve current and quick ratios.
- Secure committed short-term liquidity: obtain or confirm committed credit lines or bridge financing to cover near-term maturities and interest obligations while operating performance is negative.
- Engage creditors proactively: communicate covenant status and negotiate payment plans or covenant waivers where appropriate to reduce risk of near-term default.
- Review cost structure and cash-generating operations: identify non-essential cash outflows for reduction and consider measures to improve operating cash flow (route optimization, capacity management, contract renegotiation).
- Reconcile balance-sheet drivers: perform an accounting-level review to explain negative debt/equity and the ROE/ROA inconsistency, and disclose implications for leverage and creditor protections.
- Provide timely financial reporting and forecasts: produce short-term cash-flow forecasts (rolling 13-week or similar) and stress tests to monitor liquidity headroom and support creditor discussions.

confidence_notes:
- Assessment is based solely on the provided 2022 ratio values; no additional financial statements, notes, or multi-year trend data were available for corroboration.
- Ratios may be affected by accounting policies, one-time items, revaluations, currency translation, or non-cash adjustments not visible in the supplied metrics; these could materially affect interpretation.
- Recommendations are prudential and intended to address liquidity-centric risks identified from the supplied ratios; implementation and prioritisation should follow detailed review of the underlying financial statements and discussions with management."
liquidity_focus,Kenya Airways,2023,"summary
- This analysis reviews Kenya Airways' 2023 liquidity and related profitability and leverage ratios. The company exhibits materially constrained short-term liquidity and operating losses. Current and quick ratios are well below commonly accepted conservative thresholds for short-term liquidity. Operating and net margins are negative, and interest coverage is negative, indicating earnings do not cover interest expense. Debt-to-equity is negative, consistent with reported negative shareholders’ equity or other accounting effects. Asset turnover indicates normal asset use relative to revenue, but returns (ROA) are negative. ROE is positive, which may reflect equity accounting or one-off items; no further interpretation is made without additional balance-sheet detail.

key_risks
- Current ratio (0.4190) — materially below conservative short-term liquidity benchmarks; indicates insufficient current assets to meet current liabilities.
- Quick ratio (0.3965) — likewise materially below conservative thresholds; immediate liquidity (excluding inventory) is weak.
- Operating margin (-0.8844) and net margin (-1.0715) — large negative margins indicate operating losses and overall loss position for the period; this raises short-term solvency risk if losses persist.
- Interest coverage (-4.7042) — negative coverage indicates operating earnings are insufficient to meet interest expense, increasing default risk on debt obligations.
- Debt-to-equity (-2.3023) — negative ratio suggests negative shareholders’ equity (or similar structure); this is a significant capital-structure concern for creditors and counterparties.
- Return on assets (ROA, -1.0829) — negative return on assets indicates the company destroyed value on its asset base during the year.
- Note: Gross margin (0.0578) is low relative to conservative expectations for buffer against operating costs; while not flagged as solvency-critical alone, it provides limited cushion.

recommendations
- Immediate liquidity action: assess and prioritize measures to raise near-term cash (e.g., accelerate receivables collection, negotiate extended payment terms with suppliers, review and defer discretionary cash outflows). Quantify required cash runway under base and stress scenarios.
- Capital structure review: evaluate options to restore positive equity or otherwise strengthen the balance sheet (equity injections, debt-for-equity restructuring, creditor negotiations). Model implications for covenant compliance and access to capital.
- Interest and debt management: engage lenders to discuss covenant relief, refinancing, or temporary waivers; consider cost-of-capital reduction where feasible.
- Cost and operations focus: conduct a targeted review of operating cost lines to identify immediate, non-revenue impairing reductions to reduce operating losses. Preserve cash-critical operations.
- Reporting and monitoring: institute daily/weekly cash forecasting and a dashboard for the flagged liquidity metrics (current ratio, quick ratio, interest coverage), with escalation triggers tied to cash-runway thresholds.
- Stakeholder communication: prepare transparent communications for lenders, lessors, and major suppliers detailing cash plan and near-term liquidity measures to reduce surprise and support negotiations.

confidence_notes
- Analysis is limited to the provided 2023 ratio set; no additional financial statements or notes were reviewed.
- All observations are based solely on the supplied ratios for 2023; temporal trends, one-off items, or post-period events are not reflected.
- The identification of negative debt-to-equity assumes standard interpretation (negative equity). If accounting treatments or presentation differ, further review of the balance sheet and auditor disclosures is required.
- Recommendations are conservative and operationally focused; implementation feasibility depends on management actions and stakeholder responses."
